Symbol,Name,Last Sale,Net Change,% Change,Market Cap,Country,IPO Year,Volume,Sector,Industry
CSV,Carriage Services Inc. Common Stock,$39.85,1.81,4.758%,593328762.00,United States,,86966,Consumer Discretionary,Other Consumer Services
CTA^A,E.I. du Pont de Nemours and Company Preferred Stock,$74.00,0.00,0.00%,,United States,,111,,
CTA^B,E.I. du Pont de Nemours and Company Preferred Stock,$112.00,0.60,0.539%,,United States,,2707,,
CTBB,Qwest Corporation 6.5% Notes due 2056,$24.70,0.05,0.203%,0.00,United States,2016,30145,,
CTDD,Qwest Corporation 6.75% Notes due 2057,$24.80,0.03,0.121%,0.00,United States,2017,18982,,
CTLT,Catalent Inc. Common Stock,$109.97,0.03,0.027%,19708079673.00,United States,2014,857067,Health Care,Biotechnology: Pharmaceutical Preparations
CTO,CTO Realty Growth Inc. Common Stock,$22.56,0.47,2.128%,408405552.00,United States,1992,219109,Real Estate,Real Estate Investment Trusts
CTO^A,CTO Realty Growth Inc. 6.375% Series A Cumulative Redeemable Preferred Stock,$24.99,0.41,1.668%,,United States,,346,,
CTOS,Custom Truck One Source Inc. Common Stock,$7.39,0.26,3.647%,1829689524.00,Cayman Islands,2017,319669,Consumer Discretionary,Diversified Commercial Services
CTR,ClearBridge MLP and Midstream Total Return Fund Inc. Common Stock,$30.56,0.115,0.378%,216046976.00,United States,2012,6097,Finance,Investment Managers
CTRA,Coterra Energy Inc. Common Stock,$28.66,-0.67,-2.284%,23094375857.00,United States,,6267416,Energy,Oil & Gas Production
CTRE,CareTrust REIT Inc. Common Stock,$22.08,0.26,1.192%,2142394623.00,United States,,1231182,Real Estate,Real Estate Investment Trusts
CTS,CTS Corporation Common Stock,$42.30,0.70,1.683%,1357340251.00,United States,,82266,Technology,Industrial Machinery/Components
CTT,CatchMark Timber Trust Inc. Class A Common Stock,$11.22,0.17,1.538%,552558756.00,United States,2013,431237,Real Estate,Real Estate Investment Trusts
CTV,Innovid Corp. Common Stock,$3.35,-0.36,-9.704%,442506894.00,,2021,248860,Consumer Discretionary,Advertising
CTVA,Corteva Inc. Common Stock ,$61.76,1.49,2.472%,44695712000.00,,2019,2743950,Industrials,Major Chemicals
CUBB,Customers Bancorp Inc 5.375% Subordinated Notes Due 2034,$23.08,-0.42,-1.787%,0.00,United States,2019,501,Finance,Major Banks
CUBE,CubeSmart Common Shares,$50.61,1.14,2.304%,11358798829.00,United States,,766910,Real Estate,Real Estate Investment Trusts
CUBI,Customers Bancorp Inc Common Stock,$39.89,0.90,2.308%,1315620228.00,United States,,147425,Finance,Major Banks
CUBI^E,Customers Bancorp Inc Fixed-to-Floating Rate Non-Cumulative Perpetual Preferred Stock Series E,$25.79,0.19,0.742%,,United States,,4100,,
CUBI^F,Customers Bancorp Inc Fixed-to-Floating Rate Non-Cumulative Perpetual Preferred Stock Series F,$25.30,0.00,0.00%,,United States,,700,,
CUK,Carnival Plc ADS ADS,$9.75,0.15,1.563%,11124750000.00,United States,,1770556,,
CULP,Culp Inc. Common Stock,$5.06,-0.13,-2.505%,61976813.00,United States,,17602,Consumer Discretionary,Textiles
CURO,CURO Group Holdings Corp. Common Stock,$7.69,0.14,1.854%,310284418.00,,2017,120903,Finance,Diversified Financial Services
CURV,Torrid Holdings Inc. Common Stock,$7.01,0.76,12.16%,726753583.00,,2021,1070189,Consumer Discretionary,Clothing/Shoe/Accessory Stores
CUZ,Cousins Properties Incorporated Common Stock,$30.70,0.12,0.392%,4567045437.00,United States,,827367,Real Estate,Real Estate Investment Trusts
CVE,Cenovus Energy Inc Common Stock,$18.68,0.12,0.647%,37017315400.00,Canada,,6231701,,
CVEO,Civeo Corporation (Canada) Common Shares,$28.57,-0.26,-0.902%,404679679.00,,2014,63876,,
CVI,CVR Energy Inc. Common Stock,$32.06,0.35,1.104%,3223011004.00,United States,2007,468093,Energy,Integrated oil Companies
CVII,Churchill Capital Corp VII Class A Common Stock,$9.82,0.00,0.00%,1693950000.00,,2021,92430,Industrials,Consumer Electronics/Appliances
CVNA,Carvana Co. Class A Common Stock,$52.10,1.97,3.93%,5509256096.00,United States,2017,9498547,Consumer Discretionary,Other Specialty Stores
CVS,CVS Health Corporation Common Stock,$106.39,2.14,2.053%,139510172383.00,United States,,5063824,Health Care,Managed Health Care
CVX,Chevron Corporation Common Stock,$159.85,0.23,0.144%,314075430942.00,United States,,7242065,Energy,Integrated oil Companies
CW,Curtiss-Wright Corporation Common Stock,$147.46,3.28,2.275%,5669163255.00,United States,,69151,,
CWAN,Clearwater Analytics Holdings Inc. Class A Common Stock,$15.42,-0.19,-1.217%,2861749212.00,,2021,212520,Technology,Computer Software: Prepackaged Software
CWEN,Clearway Energy Inc. Class C Common Stock,$39.30,0.58,1.498%,4580174641.00,United States,2015,1008504,Utilities,Electric Utilities: Central
CWH,Camping World Holdings Inc. Class A Common Stock,$31.81,0.86,2.779%,1326161667.00,United States,2016,780062,Consumer Discretionary,Other Specialty Stores
CWK,Cushman & Wakefield plc Ordinary Shares,$16.50,0.33,2.041%,3721256666.00,,2018,660219,Finance,Real Estate
CWT,California Water Service Group Common Stock,$62.61,1.44,2.354%,3366727530.00,United States,,184822,Utilities,Water Supply
CX,Cemex S.A.B. de C.V. Sponsored ADR,$4.66,0.13,2.87%,6863700356.00,Mexico,,3235258,Industrials,Building Materials
CXAC,C5 Acquisition Corporation Class A Common Stock,$10.02,-0.01,-0.10%,360093750.00,,2022,370369,Industrials,Consumer Electronics/Appliances
CXE,MFS High Income Municipal Trust Common Stock,$4.14,0.02,0.485%,130516700.00,United States,1989,78032,Finance,Investment Managers
CXH,MFS Investment Grade Municipal Trust Common Stock,$8.15,0.03,0.369%,74248497.00,United States,1989,26610,Finance,Investment Managers
CXM,Sprinklr Inc. Class A Common Stock,$12.79,0.21,1.669%,3301733474.00,,2021,231716,Technology,Computer Software: Prepackaged Software
CXW,CoreCivic Inc. Common Stock,$10.07,0.20,2.026%,1196248622.00,United States,,2701436,Real Estate,Real Estate Investment Trusts
CYD,China Yuchai International Limited Common Stock,$8.92,0.10,1.134%,364455947.00,Singapore,1994,19918,Industrials,Construction/Ag Equipment/Trucks
CYH,Community Health Systems Inc. Common Stock,$3.74,-0.04,-1.058%,503756678.00,United States,2000,2532783,Health Care,Hospital/Nursing Management
CZOO,Cazoo Group Ltd Class A Ordinary Shares,$0.8402,-0.0846,-9.148%,639285054.00,,,2479320,Consumer Discretionary,Retail-Auto Dealers and Gas Stations
D,Dominion Energy Inc. Common Stock,$82.83,1.07,1.309%,67197523422.00,United States,,1845285,Utilities,Electric Utilities: Central
DAC,Danaos Corporation Common Stock,$75.38,-1.04,-1.361%,1561612710.00,Greece,2006,433593,Consumer Discretionary,Marine Transportation
DAL,Delta Air Lines Inc. Common Stock,$34.50,0.54,1.59%,22121328171.00,United States,,7131730,Consumer Discretionary,Air Freight/Delivery Services
DAN,Dana Incorporated Common Stock ,$17.55,0.62,3.662%,2541533559.00,United States,,1483935,Consumer Discretionary,Auto Parts:O.E.M.
DAO,Youdao Inc. American Depositary Shares each representing one Class A Ordinary Share,$4.80,-0.29,-5.697%,595108589.00,,2019,141624,Real Estate,Other Consumer Services
DAR,Darling Ingredients Inc. Common Stock,$77.44,1.58,2.083%,12507649271.00,United States,1997,984947,Consumer Staples,Farming/Seeds/Milling
DASH,DoorDash Inc. Class A Common Stock,$77.37,-0.52,-0.668%,27176201436.00,,2020,6678949,Industrials,Industrial Machinery/Components
DAVA,Endava plc American Depositary Shares (each representing one Class A Ordinary Share),$114.41,4.07,3.689%,6406284638.00,United States,2018,118757,Technology,EDP Services
DB,Deutsche Bank AG Common Stock,$9.37,0.23,2.516%,19365664237.00,Germany,,2555205,Finance,Commercial Banks
DBD,Diebold Nixdorf Incorporated Common Stock,$4.27,-0.19,-4.26%,337196247.00,United States,,1979614,Technology,EDP Services
DBI,Designer Brands Inc. Class A Common Stock,$18.21,-0.28,-1.514%,1281133156.00,United States,,1652690,Consumer Discretionary,Clothing/Shoe/Accessory Stores
DBL,DoubleLine Opportunistic Credit Fund Common Shares of Beneficial Interest,$16.08,0.03,0.187%,251649395.00,United States,2012,14471,,
DBRG,DigitalBridge Group Inc.,$5.70,0.16,2.888%,3736209666.00,United States,2014,3782937,Real Estate,Real Estate Investment Trusts
DBRG^H,DigitalBridge Group Inc. 7.125% Series H ,$24.35,0.00,0.00%,,United States,,3272,,
DBRG^I,DigitalBridge Group Inc. 7.15% Series I ,$24.59,0.13,0.531%,,United States,,4390,,
DBRG^J,DigitalBridge Group Inc. 7.125% Series J ,$24.63,0.00,0.00%,,United States,,3385,,
DCF,BNY Mellon Alcentra Global Credit Income 2024 Target Term Fund Inc. Common Stock,$7.73,0.08,1.046%,115794225.00,,2017,37338,Finance,Finance/Investors Services
DCI,Donaldson Company Inc. Common Stock,$56.90,0.96,1.716%,6991054176.00,United States,,247242,Industrials,Pollution Control Equipment
DCO,Ducommun Incorporated Common Stock,$49.65,1.63,3.394%,597452203.00,United States,,42602,Industrials,Military/Government/Technical
DCP,DCP Midstream  LP Common Units ,$35.12,-0.02,-0.057%,7318425324.00,United States,,285586,Utilities,Natural Gas Distribution
DCP^B,DCP Midstream LP 7.875% Series B Fixed-to-Floating Rate Cumulative Redeemable Perpetual Preferred Units,$24.75,-0.06,-0.242%,,United States,,7851,,
DCP^C,DCP Midstream LP 7.95% Series C Fixed-to-Floating Rate Cumulative Redeemable Perpetual Preferred Units,$25.81,0.07,0.272%,,United States,,7643,,
DD,DuPont de Nemours Inc. Common Stock,$62.70,0.52,0.836%,31884614622.00,,2017,2186777,Consumer Discretionary,Wholesale Distributors
DDD,3D Systems Corporation Common Stock,$12.40,0.28,2.31%,1616190642.00,United States,,1050864,Technology,Computer peripheral equipment
DDF,Delaware Investments Dividend & Income Fund Inc. Common Stock,$9.56,-0.13,-1.342%,72762670.00,United States,1993,25578,Finance,Finance/Investors Services
DDL,Dingdong (Cayman) Limited American Depositary Shares (each two representing three Ordinary Shares),$4.53,0.12,2.721%,948431554.00,,2021,1237311,,
DDS,Dillard's Inc. Common Stock,$301.60,8.85,3.023%,5285016422.00,United States,,296345,Consumer Discretionary,Department/Specialty Retail Stores
DDT,Dillard's Capital Trust I,$26.74,-0.20,-0.742%,0.00,United States,,3157,Consumer Discretionary,Department/Specialty Retail Stores
DE,Deere & Company Common Stock,$368.16,6.24,1.724%,112522829004.00,United States,,1256478,Industrials,Industrial Machinery/Components
DEA,Easterly Government Properties Inc. Common Stock,$19.02,0.12,0.635%,1726633641.00,United States,2015,474809,Real Estate,Real Estate Investment Trusts
DECK,Deckers Outdoor Corporation Common Stock,$333.38,4.33,1.316%,8931203860.00,United States,1993,227851,Consumer Discretionary,Shoe Manufacturing
DEI,Douglas Emmett Inc. Common Stock,$22.70,0.07,0.309%,3990299910.00,United States,2006,1078181,Real Estate,Real Estate Investment Trusts
DELL,Dell Technologies Inc. Class C Common Stock ,$48.22,0.62,1.303%,35659538672.00,,2018,1987275,Technology,Computer Manufacturing
DEN,Denbury Inc. Common Stock,$80.24,1.30,1.647%,4041610406.00,,2020,453851,Energy,Oil & Gas Production
DEO,Diageo plc Common Stock,$188.96,1.09,0.58%,107804957511.00,United Kingdom,,403166,Consumer Staples,Beverages (Production/Distribution)
DESP,Despegar.com Corp. Ordinary Shares,$8.69,0.16,1.876%,575605552.00,,2017,509829,Consumer Discretionary,Other Consumer Services
DEX,Delaware Enhanced Global Dividend Common Shares of Beneficial Interest,$8.15,0.25,3.165%,86861926.00,United States,2007,50247,Finance,Finance Companies
DFIN,Donnelley Financial Solutions Inc. Common Stock ,$44.25,1.39,3.243%,1406689048.00,,2016,182137,Finance,Investment Managers
DFP,Flaherty & Crumrine Dynamic Preferred and Income Fund Inc. Common Stock,$23.0746,-0.0154,-0.067%,464638452.00,,2013,50986,Finance,Investment Managers
DFS,Discover Financial Services Common Stock,$109.60,1.09,1.005%,30140000000.00,United States,,1004688,Finance,Finance: Consumer Services
DG,Dollar General Corporation Common Stock,$253.30,1.43,0.568%,57498344659.00,United States,2009,1025970,Consumer Discretionary,Department/Specialty Retail Stores
DGX,Quest Diagnostics Incorporated Common Stock,$140.55,-0.02,-0.014%,16444350000.00,United States,,648449,Health Care,Medical Specialities
DHF,BNY Mellon High Yield Strategies Fund Common Stock,$2.48,0.04,1.639%,180386604.00,United States,1998,621393,Finance,Finance Companies
DHI,D.R. Horton Inc. Common Stock,$79.72,1.02,1.296%,27692897390.00,United States,,1815322,,
DHR,Danaher Corporation Common Stock,$297.75,6.57,2.256%,216596854451.00,United States,,2361877,Health Care,Medical Specialities
DHR^B,Danaher Corporation 5.00% Mandatory Convertible Preferred Stock Series B,$1504.83,0.00,0.00%,,United States,,387,,
DHT,DHT Holdings Inc.,$7.83,0.09,1.163%,1306038777.00,Jersey,2005,1693183,Consumer Discretionary,Marine Transportation
DHX,DHI Group Inc. Common Stock,$5.36,0.19,3.675%,253711987.00,United States,2007,156980,Consumer Discretionary,Diversified Commercial Services
DIAX,Nuveen Dow 30SM Dynamic Overwrite Fund Common Shares of Beneficial Interest,$16.44,0.17,1.045%,597872066.00,,2014,47146,Finance,Finance Companies
DIN,Dine Brands Global Inc. Common Stock,$75.16,2.51,3.455%,1259006062.00,United States,,207921,Consumer Discretionary,Restaurants
DINO,HF Sinclair Corporation Common Stock,$51.63,0.99,1.955%,11525351012.00,United States,1960,1217369,Energy,Integrated oil Companies
DIS,Walt Disney Company (The) Common Stock,$121.57,3.88,3.297%,221437778515.00,United States,,21946200,Consumer Discretionary,Movies/Entertainment
DK,Delek US Holdings Inc. Common Stock,$28.40,0.38,1.356%,2009160414.00,United States,2017,1027490,Energy,Integrated oil Companies
DKL,Delek Logistics Partners L.P. Common Units representing Limited Partner Interests,$55.74,0.68,1.235%,2423228609.00,United States,2012,66127,Energy,Oil & Gas Production
DKS,Dick's Sporting Goods Inc Common Stock,$107.24,2.13,2.026%,8635746043.00,United States,2002,803426,Consumer Discretionary,Other Specialty Stores
DLB,Dolby Laboratories Common Stock,$80.75,1.40,1.764%,8147237658.00,United States,2005,297803,Technology,EDP Services
DLNG,Dynagas LNG Partners LP Common Units,$3.28,-0.08,-2.381%,120711370.00,Greece,,45099,,
DLNG^A,Dynagas LNG Partners LP 9.00% Series A Cumulative Redeemable Preferred Units,$24.2501,0.0601,0.248%,,Greece,,4222,,
DLNG^B,Dynagas LNG Partners LP 8.75% Series B Fixed to Floating Rate Cumulative Redeemable Perpetual Preferred Units liquidation preference $25.00 per Uni,$25.38,-0.2699,-1.052%,,Greece,,6037,,
DLR,Digital Realty Trust Inc. Common Stock,$131.42,2.39,1.852%,37411641814.00,United States,2004,1200543,Real Estate,Real Estate Investment Trusts
DLR^J,Digital Realty Trust Inc. 5.250% Series J Cumulative Redeemable Preferred Stock,$24.86,0.25,1.016%,,United States,,1021,,
DLR^K,Digital Realty Trust Inc. 5.850% Series K Cumulative Redeemable Preferred Stock par value $0.01 per share,$26.17,0.12,0.461%,,United States,,5320,,
DLR^L,Digital Realty Trust Inc. 5.200% Series L Cumulative Redeemable Preferred Stock,$24.83,0.16,0.649%,,United States,,6388,,
DLX,Deluxe Corporation Common Stock,$23.28,0.27,1.173%,1000820260.00,United States,,177498,Consumer Discretionary,Advertising
DLY,DoubleLine Yield Opportunities Fund Common Shares of Beneficial Interest,$15.37,0.11,0.721%,736926623.00,,2020,75296,Finance,Investment Managers
DM,Desktop Metal Inc. Class A Common Stock,$3.34,0.18,5.696%,1046960809.00,,2019,8380496,Technology,Computer peripheral equipment
DMA,Destra Multi-Alternative Fund Common Stock,$7.25,0.09,1.257%,64983483.00,,2022,20955,Finance,Trusts Except Educational Religious and Charitable
DMB,BNY Mellon Municipal Bond Infrastructure Fund Inc. Common Stock,$14.58,0.54,3.846%,268257333.00,,2013,83840,Finance,Trusts Except Educational Religious and Charitable
DMO,Western Asset Mortgage Opportunity Fund Inc. Common Stock,$12.69,0.13,1.035%,145494035.00,United States,2010,22991,Finance,Trusts Except Educational Religious and Charitable
DMS,Digital Media Solutions Inc. Class A Ordinary Shares,$1.75,-0.36,-17.062%,68936511.00,United States,2018,1690364,Consumer Discretionary,Advertising
DMYS,dMY Technology Group Inc. VI Class A Common Stock,$9.84,0.04,0.408%,297045000.00,,2021,773,Industrials,Consumer Electronics/Appliances
DNA,Ginkgo Bioworks Holdings Inc. Class A Common Stock,$3.63,0.23,6.765%,6449192096.00,United States,2021,35949995,Health Care,Biotechnology: Biological Products (No Diagnostic Substances)
DNB,Dun & Bradstreet Holdings Inc. Common Stock,$16.27,0.15,0.931%,7062504687.00,United States,2020,5841228,Technology,Internet and Information Services
DNMR,Danimer Scientific Inc. Common Stock,$5.66,0.85,17.672%,572310113.00,,2020,3555074,Industrials,Plastic Products
DNOW,NOW Inc. Common Stock,$11.35,0.07,0.621%,1256541634.00,,2014,522058,Industrials,Metal Fabrications
DNP,DNP Select Income Fund Inc. Common Stock,$11.41,0.02,0.176%,3978210874.00,United States,1987,296592,Finance,Investment Managers
DNZ,D and Z Media Acquisition Corp. Class A Common Stock,$9.87,0.00,0.00%,354703125.00,,2021,4,Industrials,Consumer Electronics/Appliances
DO,Diamond Offshore Drilling Inc. Common Stock,$7.28,0.23,3.262%,728545621.00,United States,2022,989177,Energy,Oil & Gas Production
DOC,Physicians Realty Trust Common Shares of Beneficial Interest,$18.16,0.26,1.453%,4091376976.00,United States,2013,1581356,Real Estate,Real Estate Investment Trusts
DOCN,DigitalOcean Holdings Inc. Common Stock,$48.76,1.24,2.609%,4978396000.00,United States,2021,1186257,Technology,Retail: Computer Software & Peripheral Equipment
DOCS,Doximity Inc. Class A Common Stock,$37.98,-0.71,-1.835%,7348723614.00,,2021,1440570,Technology,Retail: Computer Software & Peripheral Equipment
DOLE,Dole plc Ordinary Shares,$9.30,-0.04,-0.428%,882362666.00,,2021,472787,,
DOMA,Doma Holdings Inc. Common Stock,$0.9769,0.0387,4.125%,317209220.00,,2021,1523561,Finance,Real Estate
DOOR,Masonite International Corporation Ordinary Shares (Canada),$93.18,1.39,1.514%,2102602600.00,Canada,,115923,,
DOUG,Douglas Elliman Inc. Common Stock,$5.99,0.25,4.355%,486601400.00,,2021,261780,Real Estate,Building operators
DOV,Dover Corporation Common Stock,$139.48,3.00,2.198%,20022258038.00,United States,,755701,Industrials,Industrial Machinery/Components
DOW,Dow Inc. Common Stock ,$55.93,0.67,1.212%,40167106989.00,,2019,4387002,Industrials,Industrial Specialties
DPG,Duff & Phelps Utility and Infrastructure Fund Inc.,$15.06,0.13,0.871%,573035078.00,United States,2011,75812,Finance,Trusts Except Educational Religious and Charitable
DPZ,Domino's Pizza Inc Common Stock,$412.24,8.11,2.007%,14793275685.00,United States,2004,509987,Consumer Discretionary,Food Distributors
DQ,DAQO New Energy Corp. American Depositary Shares each representing five ordinary shares,$68.74,-1.99,-2.814%,5121606368.00,China,2010,1219532,Technology,Semiconductors
DRD,DRDGOLD Limited American Depositary Shares,$6.52,0.16,2.516%,559400639.00,South Africa,,101809,Basic Materials,Precious Metals
DRE,Duke Realty Corporation Common Stock,$64.86,1.47,2.319%,24959447382.00,United States,,1736452,Real Estate,Real Estate Investment Trusts
DRH,Diamondrock Hospitality Company Common Stock,$9.88,0.18,1.856%,2083307717.00,United States,2005,794272,Real Estate,Real Estate Investment Trusts
DRH^A,Diamondrock Hospitality Company 8.250% Series A Cumulative Redeemable Preferred Stock,$27.00,0.22,0.822%,,United States,,782,,
DRI,Darden Restaurants Inc. Common Stock,$131.91,1.68,1.29%,16453706789.00,United States,,753015,Consumer Discretionary,Restaurants
DRQ,Dril-Quip Inc. Common Stock,$24.30,0.48,2.015%,838808249.00,United States,1997,170675,Industrials,Metal Fabrications
DS,Drive Shack Inc.,$1.36,-0.05,-3.546%,125643626.00,United States,,793011,Consumer Discretionary,Movies/Entertainment
DS^B,Drive Shack Inc. Preferred Series B,$22.76,0.16,0.708%,,United States,,587,,
DS^C,Drive Shack Inc. Preferred Series C,$19.80,0.00,0.00%,,United States,,37,,
DS^D,Drive Shack Inc. Pfd Ser D,$21.00,0.135,0.647%,,United States,,800,,
DSL,DoubleLine Income Solutions Fund Common Shares of Beneficial Interests,$13.24,0.19,1.456%,1350438003.00,,2013,317328,Finance,Trusts Except Educational Religious and Charitable
DSM,BNY Mellon Strategic Municipal Bond Fund Inc. Common Stock,$6.70,-0.01,-0.149%,331172230.00,United States,1989,74545,Finance,Investment Managers
DSU,Blackrock Debt Strategies Fund Inc. Common Stock,$10.15,0.06,0.595%,473094667.00,United States,1998,152701,Finance,Finance Companies
DSX,Diana Shipping inc. common stock,$5.79,-0.16,-2.689%,498763674.00,Greece,2005,1783651,Consumer Discretionary,Marine Transportation
DSX^B,Diana Shipping Inc. Perpetual Preferred Shares Series B (Marshall Islands),$25.98,0.15,0.581%,,Greece,,1800,,
DT,Dynatrace Inc. Common Stock,$43.30,0.45,1.05%,12438342196.00,United States,2019,1771763,Technology,EDP Services
DTB,DTE Energy Company 2020 Series G 4.375% Junior Subordinated Debentures due 2080,$22.49,0.01,0.044%,0.00,United States,2020,11795,Utilities,Electric Utilities: Central
DTC,Solo Brands Inc. Class A Common Stock,$5.91,-0.09,-1.50%,374698563.00,,2021,1413558,Miscellaneous,Diversified Commercial Services
DTE,DTE Energy Company Common Stock,$134.91,1.58,1.185%,26137350885.00,United States,,1080323,Utilities,Electric Utilities: Central
DTF,DTF Tax-Free Income 2028 Term Fund Inc. Common Stock,$12.42,0.01,0.081%,87307222.00,United States,1991,18161,Finance,Investment Managers
DTG,DTE Energy Company 2021 Series E 4.375% Junior Subordinated Debentures,$20.66,0.33,1.623%,0.00,United States,2021,26902,Utilities,Electric Utilities: Central
DTLA^,Brookfield DTLA Inc. 7.625% Series A Cumulative Redeemable Preferred Stock,$9.96,-0.36,-3.488%,,,,1837,,
DTM,DT Midstream Inc. Common Stock ,$57.64,-0.35,-0.604%,5575749143.00,,2021,540636,Utilities,Oil & Gas Production
DTP,DTE Energy Company 6.25% Corporate Units,$52.09,0.31,0.599%,0.00,United States,,68891,Utilities,Electric Utilities: Central
DTW,DTE Energy Company 2017 Series E 5.25% Junior Subordinated Debentures due 2077,$25.08,0.08,0.32%,0.00,United States,2017,10639,Utilities,Electric Utilities: Central
DUK,Duke Energy Corporation (Holding Company) Common Stock,$110.25,1.74,1.604%,84881528141.00,United States,,3302654,Utilities,Power Generation
DUK^A,Duke Energy Corporation Depositary Shares each representing a 1/1000th interest in a share of 5.75% Series A Cumulative Redeemable Perpetual Preferred Stock,$25.76,0.01,0.039%,,United States,,54799,,
DUKB,Duke Energy Corporation 5.625% Junior Subordinated Debentures due 2078,$25.94,-0.04,-0.154%,0.00,United States,2018,22533,Utilities,Power Generation
DV,DoubleVerify Holdings Inc. Common Stock,$27.33,0.28,1.035%,4468545052.00,,2021,885353,Technology,Computer Software: Prepackaged Software
DVA,DaVita Inc. Common Stock,$92.48,0.89,0.972%,8748608000.00,United States,,489012,Health Care,Medical/Nursing Services
DVN,Devon Energy Corporation Common Stock,$65.55,1.09,1.691%,43263000000.00,United States,1985,8705666,Energy,Oil & Gas Production
DWIN,Delwinds Insurance Acquisition Corp. Class A Common Stock,$10.08,0.005,0.05%,168450186.00,,2021,880,Industrials,Consumer Electronics/Appliances
DX,Dynex Capital Inc. Common Stock,$16.55,0.07,0.425%,677316644.00,United States,,589793,Real Estate,Real Estate Investment Trusts
DX^C,Dynex Capital Inc. 6.900% Series C Fixed-to-Floating Rate Cumulative Redeemable Preferred Stock,$23.88,0.37,1.574%,,United States,,10198,,
DXC,DXC Technology Company Common Stock ,$26.64,0.33,1.254%,6118005177.00,,,1333676,Technology,EDP Services
DY,Dycom Industries Inc. Common Stock,$111.80,3.11,2.861%,3303910358.00,United States,,321055,Industrials,Water Sewer Pipeline Comm & Power Line Construction
E,ENI S.p.A. Common Stock,$24.14,0.00,0.00%,42724863055.00,Italy,,410071,Energy,Oil & Gas Production
EAF,GrafTech International Ltd. Common Stock,$7.09,0.17,2.457%,1844987685.00,United States,2018,1987594,Consumer Discretionary,Metal Fabrications
EAI,Entergy Arkansas LLC First Mortgage Bonds 4.875% Series Due September 1 2066,$25.23,0.02,0.079%,0.00,United States,2016,5764,,
EARN,Ellington Residential Mortgage REIT Common Shares of Beneficial Interest,$8.75,0.07,0.806%,114711853.00,United States,2013,90340,Real Estate,Real Estate Investment Trusts
EAT,Brinker International Inc. Common Stock,$32.88,1.48,4.713%,1441495105.00,United States,,997107,Consumer Discretionary,Restaurants
EB,Eventbrite Inc. Class A Common Stock,$8.19,0.03,0.368%,800037185.00,United States,2018,2317069,Technology,EDP Services
EBF,Ennis Inc. Common Stock,$21.70,0.11,0.509%,560215706.00,United States,,253068,Consumer Discretionary,Office Equipment/Supplies/Services
EBR,Centrais Electricas Brasileiras S A American Depositary Shares (Each representing one Common Share),$9.27,0.12,1.311%,21332381493.00,,2016,1754596,Utilities,Electric Utilities: Central
EBS,Emergent Biosolutions Inc. Common Stock,$30.50,0.61,2.041%,1532430532.00,United States,2006,1132051,Health Care,Biotechnology: Pharmaceutical Preparations
EC,Ecopetrol S.A. American Depositary Shares,$11.22,0.23,2.093%,23066465715.00,Colombia,,868145,Energy,Oil & Gas Production
ECAT,BlackRock ESG Capital Allocation Trust Common Shares of Beneficial Interest,$15.40,-0.01,-0.065%,1612981401.00,,2021,216766,Finance,Trusts Except Educational Religious and Charitable
ECC           ,Eagle Point Credit Company Inc. Common Stock,$11.27,0.09,0.805%,465046452.00,United States,2014,305356,Finance,Trusts Except Educational Religious and Charitable
ECC^D,Eagle Point Credit Company Inc. 6.75% Series D Preferred Stock,$23.2639,0.3538,1.544%,,United States,,2423,,
ECCC,Eagle Point Credit Company Inc. 6.50% Series C Term Preferred Stock due 2031,$23.9649,0.0649,0.272%,0.00,United States,,1936,Finance,Trusts Except Educational Religious and Charitable
ECCV,Eagle Point Credit Company Inc. 5.375% Notes due 2029,$23.02,-0.15,-0.647%,0.00,United States,2022,21539,Finance,Trusts Except Educational Religious and Charitable
ECCW,Eagle Point Credit Company Inc. 6.75% Notes due 2031,$24.75,-0.1881,-0.754%,0.00,United States,2021,590,Finance,Trusts Except Educational Religious and Charitable
